{
  "meta": {
    "url": "https://example.com",
    "timestamp_utc": "2026-07-31T23:30:22Z",
    "device": "mobile",
    "runs": 3,
    "tool": "lighthouse"
  },
  "vitals": {
    "lcp_ms": 0.0,
    "cls": 0.0,
    "inp_ms": 0.0,
    "ttfb_ms": 0.0
  },
  "images": [
    {
      "src": "https://cdn.shopify.com/s/files/1/0123/4567/files/hero-fullsize-unoptimized.jpg",
      "role": "hero",
      "score": 0,
      "bytes": 1200000,
      "mime": "image/jpeg",
      "displayed_width": 1200,
      "displayed_height": 600,
      "natural_width": 2400,
      "natural_height": 1200,
      "is_lcp_candidate": true,
      "waste_bytes_est": 1164000,
      "recommendation": "Optimize LCP image: compress and use modern format (WebP/AVIF)"
    },
    {
      "src": "https://cdn.shopify.com/s/files/1/0123/4567/files/product-a.jpg",
      "role": "product_primary",
      "score": 29,
      "bytes": 380000,
      "mime": "image/jpeg",
      "displayed_width": 600,
      "displayed_height": 600,
      "is_lcp_candidate": false,
      "waste_bytes_est": 362000,
      "recommendation": "Use responsive images or lazy-load below fold"
    },
    {
      "src": "https://cdn.shopify.com/s/files/1/0123/4567/files/logo.png",
      "role": "decorative",
      "score": 2,
      "bytes": 45000,
      "mime": "image/png",
      "displayed_width": 200,
      "displayed_height": 60,
      "is_lcp_candidate": false,
      "waste_bytes_est": 44400,
      "recommendation": "Review size and format for better performance"
    }
  ],
  "summary": {
    "top_issues": [
      "LCP image is very large (1200000 bytes) – compress or use modern format",
      "2 image(s) have significant byte waste (>100 KB estimated)",
      "3 image(s) not using modern format (WebP/AVIF)"
    ]
  }
}